[
  {
    "path": ".",
    "role": "catalog-root",
    "status": "candidate",
    "evidence": [
      "PATH-TYPING.md",
      "CHUNK-MAP.md#4-posix-to-spotcomp"
    ]
  },
  {
    "path": "schema/eavt-row.schema.json",
    "role": "schema-witness",
    "status": "candidate",
    "thingSlug": "eavt-row",
    "schemaPath": "schema/eavt-row.schema.json",
    "evidence": [
      "schema/eavt-row.schema.json",
      "PATH-TYPING.md#5-trc-per-thing-contract"
    ],
    "openObligations": [
      "D1",
      "D3"
    ]
  },
  {
    "path": "src/trace.mjs",
    "role": "support-artifact",
    "status": "candidate",
    "authoritative": false,
    "evidence": [
      "IMPLEMENTATION.md",
      "CATEGORICAL-MACHINERY.md#10-implementation-subordination"
    ]
  }
]
